{
  "protocol": "factory.qualification.v1",
  "protocolVersion": "1.0.0",
  "generatedAt": "REPLACE_ISO8601",
  "tenantId": "TENANT_ID",
  "loopId": "qual-REPLACE_TIMESTAMP",
  "status": "in-progress",
  "iteration": 1,
  "criteria": [
    {
      "id": "crit.manifest-valid",
      "name": "Manifest validates against schema",
      "required": true,
      "result": "pending",
      "evidence": "",
      "notes": ""
    },
    {
      "id": "crit.audit-pass",
      "name": "Audit status is pass",
      "required": true,
      "result": "pending",
      "evidence": "",
      "notes": ""
    },
    {
      "id": "crit.health-acceptable",
      "name": "Health status is healthy or degraded",
      "required": true,
      "result": "pending",
      "evidence": "",
      "notes": ""
    },
    {
      "id": "crit.report-complete",
      "name": "factory-report.md present and complete",
      "required": true,
      "result": "pending",
      "evidence": "",
      "notes": ""
    },
    {
      "id": "crit.package-complete",
      "name": "All required package files present",
      "required": true,
      "result": "pending",
      "evidence": "",
      "notes": ""
    },
    {
      "id": "crit.integration-honesty",
      "name": "No false integration claims",
      "required": true,
      "result": "pending",
      "evidence": "",
      "notes": ""
    }
  ],
  "blockers": []
}
