{
  "protocol": "factory.qualification.v1",
  "protocolVersion": "1.0.0",
  "generatedAt": "2026-07-05T12:00:00Z",
  "tenantId": "citadel",
  "loopId": "qual-20260705-120000",
  "status": "provisional",
  "iteration": 1,
  "criteria": [
    {
      "id": "crit.manifest-valid",
      "name": "Manifest validates against schema",
      "required": true,
      "result": "met",
      "evidence": "factory-manifest.json validates"
    },
    {
      "id": "crit.audit-pass",
      "name": "Audit status is pass",
      "required": true,
      "result": "unmet",
      "evidence": "Audit status partial due to integration check failure",
      "notes": "Non-security failure; provisional qualification granted"
    },
    {
      "id": "crit.health-acceptable",
      "name": "Health status is healthy or degraded",
      "required": true,
      "result": "met",
      "evidence": "Health status degraded"
    },
    {
      "id": "crit.report-complete",
      "name": "factory-report.md present and complete",
      "required": true,
      "result": "met"
    },
    {
      "id": "crit.package-complete",
      "name": "All required package files present",
      "required": true,
      "result": "met"
    },
    {
      "id": "crit.integration-honesty",
      "name": "No false integration claims",
      "required": true,
      "result": "met",
      "evidence": "Horizon listed only under declared, not implemented"
    }
  ],
  "blockers": [
    {
      "id": "blocker.horizon-integration",
      "description": "Horizon integration declared but not implemented",
      "repairRef": "check.integration.horizon"
    }
  ],
  "expiresAt": "2026-08-05T12:00:00Z"
}
