{
  "protocol": "factory.qualification.v1",
  "protocolVersion": "1.0.0",
  "generatedAt": "2026-07-05T17:45:00Z",
  "tenantId": "factory-core",
  "loopId": "qual-factory-core-001",
  "status": "qualified",
  "iteration": 1,
  "criteria": [
    {
      "id": "crit.manifest-valid",
      "name": "Manifest validates against schema",
      "required": true,
      "result": "met",
      "evidence": "Validated by factory-standards npm run validate:package"
    },
    {
      "id": "crit.audit-pass",
      "name": "Audit status is pass",
      "required": true,
      "result": "met"
    },
    {
      "id": "crit.health-acceptable",
      "name": "Health status is healthy or degraded",
      "required": true,
      "result": "met",
      "evidence": "Health healthy"
    },
    {
      "id": "crit.report-complete",
      "name": "factory-report.md present and complete",
      "required": true,
      "result": "met",
      "evidence": "Standard filename factory-report.md (not factory-report.md5.md)"
    },
    {
      "id": "crit.package-complete",
      "name": "All required package files present",
      "required": true,
      "result": "met"
    },
    {
      "id": "crit.integration-honesty",
      "name": "No false integration claims",
      "required": true,
      "result": "met",
      "evidence": "factory-standards mode imported; no connected tenant apps"
    }
  ],
  "blockers": [],
  "qualifiedAt": "2026-07-05T17:45:00Z"
}
